{
  "schemaVersion": "2.0",
  "contentVersion": "1.0.0",
  "id": "major-11",
  "arcana": "major",
  "number": 11,
  "romanNumeral": "XI",
  "name": {
    "zh": "正义",
    "en": "Justice"
  },
  "core": {
    "summary": "事实、责任与后果需要在清晰标准下衡量",
    "symbols": [
      {
        "name": "天平",
        "meaning": "高举的金色天平，象征把证据、比例与多方观点放在同一标准下衡量。"
      },
      {
        "name": "宝剑",
        "meaning": "笔直向上的双刃剑，代表清晰判断以及决定必然带来的后果。"
      },
      {
        "name": "红袍",
        "meaning": "端坐的红色长袍，象征行动与热度，提示判断并非冷漠抽离。"
      },
      {
        "name": "方形冠饰",
        "meaning": "头顶方形冠饰，代表秩序、理性与不轻易摇摆的稳定原则。"
      }
    ],
    "element": "风"
  },
  "upright": {
    "keywords": ["权衡", "事实核对", "承担后果", "一致标准"],
    "overview": "正义正位提醒你，眼前的判断需要把事实、感受和责任分开来看，再用同一套标准衡量自己和他人，而不是两套标准各说各话。清晰不是冷漠，而是让决定经得起时间和旁人事后的检验。",
    "light": "把情绪和事实分开梳理，能帮助你看清一件事真正的样子，而不是最先感受到的那个版本。",
    "shadow": "过度追求“公平”的表象，可能让你忽略具体情境里的人情与例外，变得机械地套用规则。",
    "advice": [
      "把这件事的事实、你的感受和需要承担的责任分别写出来，再做判断。",
      "在下结论前，主动找一条可能推翻你当前判断的信息。"
    ],
    "reflection": "如果这次要为自己的判断承担全部后果，你还会这样决定吗？"
  },
  "reversed": {
    "keywords": ["偏袒自己", "非黑即白", "回避后果", "证据不全"],
    "overview": "正义逆位常出现在判断已经悄悄偏向对自己有利的一面，却仍以为自己客观公正的时候。也可能是把复杂的情况简化成对错分明的两边，借此回避了其中需要自己承担的具体责任与代价。",
    "light": "察觉自己一直在为某个决定找理由，是重新回到事实本身的提醒。",
    "shadow": "用对错分明的框架评判他人，往往是在逃避自己也需要承担的那部分责任。",
    "advice": [
      "找一个立场不同的人，听听他们如何描述同一件事的经过。",
      "承认这件事里自己需要负责的具体部分，不把全部原因归给对方。"
    ],
    "reflection": "如果对方是你，你会用同一套标准要求自己吗？"
  },
  "topics": {
    "love": {
      "upright": "关系中的分歧适合先分清事实和感受，再讨论各自需要承担的部分，而不是急着评判谁对谁错。",
      "reversed": "留意自己是否只记得对自己有利的版本。感情里的公平需要双方都被如实倾听。"
    },
    "career": {
      "upright": "面对需要评估的工作决定，适合列出具体标准，用同一套尺度衡量所有相关的人和事。",
      "reversed": "如果评价某件事时只挑对自己有利的信息，这份判断很难真正立得住。"
    },
    "family": {
      "upright": "家庭中的分工或矛盾适合摆到台面上，用事实而非情绪化的指责来厘清各自的责任。",
      "reversed": "把家人简单分成对的一方和错的一方，往往会忽略事情本来更复杂的成因。"
    },
    "mood": {
      "upright": "情绪波动时适合先分辨这是基于事实的反应，还是被过去经验放大的感受。",
      "reversed": "如果你正在严厉地评判自己或他人，留意这份苛刻背后是否藏着未被承认的委屈。"
    },
    "finance": {
      "upright": "适合把收支和决定摆在明确的数字上核对，用具体标准检查每一笔安排是否合理。",
      "reversed": "留意是否为一次不理想的财务决定找借口。核对实际数字，比说服自己更重要。"
    },
    "growth": {
      "upright": "这个阶段的成长在于练习诚实面对自己的选择和后果，而不是急着证明自己一直是对的。",
      "reversed": "如果你习惯把事情简化成非黑即白，试着练习在判断中留一点复杂和例外的空间。"
    }
  },
  "editorial": {
    "status": "draft",
    "lastReviewedAt": null,
    "sourceNotes": "基于 Rider–Waite–Smith 象征体系编写的 Arcana 原创中文草稿，待独立内容审核。"
  }
}
