{
  "schemaVersion": "2.0",
  "contentVersion": "1.0.0",
  "id": "minor-wands-five",
  "arcana": "minor",
  "number": 5,
  "suit": "wands",
  "rank": "five",
  "name": {
    "zh": "权杖五",
    "en": "Five of Wands"
  },
  "core": {
    "summary": "五个年轻人挥舞权杖彼此交错，呈现竞争、意见碰撞与尚未形成规则的混乱能量。",
    "symbols": [
      {
        "name": "交错权杖",
        "meaning": "多股意志同时发力，既有摩擦，也可能孕育新做法。"
      },
      {
        "name": "五位人物",
        "meaning": "立场各异却都在场，象征差异需要被协调而非抹去。"
      },
      {
        "name": "彩色衣饰",
        "meaning": "不同背景与表达方式增加冲突，也带来多元资源。"
      },
      {
        "name": "不稳姿态",
        "meaning": "缺少共同规则时，行动容易互相干扰。"
      }
    ],
    "element": "火"
  },
  "upright": {
    "keywords": [
      "竞争",
      "碰撞",
      "协商",
      "磨合"
    ],
    "overview": "不同声音正在争夺空间，未必意味着谁错了。权杖五把注意力放在如何让分歧产生建设性的张力：厘清议题、规则和角色，而不是把所有摩擦都当成敌意。",
    "light": "竞争能暴露盲点，促使技能、方案和边界更清晰。",
    "shadow": "逞强、抢话或把小事升级为立场之争，会消耗共同目标。",
    "advice": [
      "先复述对方真正关心的点，再表达自己的不同。",
      "为争议设定决策标准，避免讨论无限绕圈。"
    ],
    "reflection": "这场冲突在保护什么价值，又在浪费什么能量？"
  },
  "reversed": {
    "keywords": [
      "内耗",
      "回避冲突",
      "恶性竞争",
      "失序"
    ],
    "overview": "冲突可能转入暗处，表现为消极配合、反复比较或难以说出口的怨气。逆位也提醒你，有些争执已不再产生价值，值得及时退出。",
    "light": "减少无效对抗能为真正重要的议题保留精力。",
    "shadow": "一味回避会让不满累积，最后以更难收拾的形式爆发。",
    "advice": [
      "选择一个具体分歧，在情绪平稳时提出可执行的请求。",
      "停止参与只为证明输赢的比较，回到自己的标准。"
    ],
    "reflection": "你是在避免伤害，还是害怕被看见不同？"
  },
  "topics": {
    "love": {
      "upright": "关系中的小争执可帮助双方了解界线，关键是避免人格攻击。",
      "reversed": "冷战或暗中较劲会让亲密感下降，先说出真正受伤的部分。"
    },
    "career": {
      "upright": "团队创意碰撞旺盛，适合用评审标准把竞争导向改进。",
      "reversed": "职责不清易引发抢功或推责，先把任务和权限写明。"
    },
    "family": {
      "upright": "家庭里不同习惯需要协商，别让旧比较决定谁更有道理。",
      "reversed": "被压下的家庭矛盾可能以挑剔表现，找合适时机谈事实。"
    },
    "mood": {
      "upright": "你正感到烦躁或被比较，运动和写作能帮助释放紧绷。",
      "reversed": "耗在脑内辩论会加重疲惫，先离开刺激源让情绪降温。"
    },
    "finance": {
      "upright": "可审视比较心如何影响消费，避免为了胜过别人做超出范围的选择。",
      "reversed": "金钱分歧应回到记录和共同规则，不以情绪压力促成决定。"
    },
    "growth": {
      "upright": "学习在分歧中保持自我，不等于必须每次都赢。",
      "reversed": "若冲突已失去议题，练习退出和转向比继续证明更成熟。"
    }
  },
  "editorial": {
    "status": "approved",
    "lastReviewedAt": "2026-07-21",
    "sourceNotes": "基于 Rider–Waite–Smith 象征体系编写的 Arcana 原创中文牌义；权杖花色首批，2026-07-21 代理审查后标记 approved。"
  }
}
