{
  "schemaVersion": "2.0",
  "contentVersion": "1.0.0",
  "id": "minor-pentacles-page",
  "arcana": "minor",
  "number": 11,
  "suit": "pentacles",
  "rank": "page",
  "name": {
    "zh": "钱币侍从",
    "en": "Page of Pentacles"
  },
  "core": {
    "summary": "年轻侍从在田野中凝视钱币，象征好奇学习、务实承诺与初识资源价值。",
    "symbols": [
      {
        "name": "凝视钱币",
        "meaning": "专注的目光代表对新技能与现实可能性的认真探究。"
      },
      {
        "name": "绿色田野",
        "meaning": "丰沃田地象征学习需要落进可实践的环境。"
      },
      {
        "name": "远方山脉",
        "meaning": "山峦提示务实起点仍有长远的挑战可攀。"
      },
      {
        "name": "红色羽帽",
        "meaning": "鲜艳帽饰表现初学者愿意尝试的生气。"
      }
    ],
    "element": "土"
  },
  "upright": {
    "keywords": [
      "学习",
      "好奇",
      "务实",
      "新机会"
    ],
    "overview": "侍从双手托起钱币，像在研究一件新发现的工具。正位鼓励你以谦逊和具体计划接近学习、工作或身体目标，让好奇心找到可实行的容器。",
    "light": "你愿意从基础开始，因而能把兴趣逐步变成可靠能力。",
    "shadow": "若只收集新目标却不开始实践，潜力会停留在想象中。",
    "advice": [
      "选择一项资源或技能，查明它的实际学习路径。",
      "为初次尝试准备简单且可完成的材料。"
    ],
    "reflection": "你愿意认真学习的现实课题是什么？"
  },
  "reversed": {
    "keywords": [
      "拖延",
      "不切实际",
      "分心",
      "准备不足"
    ],
    "overview": "逆位提示学习计划可能缺少落实，或你对一项机会抱有未经检验的期待。它邀请你回到基础资料、时间安排与身体容量，而非用热情代替准备。",
    "light": "发现准备不足，正好让你补上真正需要的步骤。",
    "shadow": "害怕显得笨拙可能使你不断观望，迟迟不肯成为初学者。",
    "advice": [
      "把模糊愿望改成一个可练习的具体问题。",
      "向有经验的人确认你遗漏的基本条件。"
    ],
    "reflection": "你需要补上的，是知识、时间还是勇气？"
  },
  "topics": {
    "love": {
      "upright": "用好奇而不急于定义的态度认识彼此，关系会有稳当的起点。",
      "reversed": "若只停在想象未来，需回到双方实际愿意投入的行动。"
    },
    "career": {
      "upright": "适合培训、实习或研究新领域，把提问视为专业的一部分。",
      "reversed": "工作计划迟迟不动时，先确认最基础的工具和期限。"
    },
    "family": {
      "upright": "年轻成员的新兴趣值得被认真倾听，并给予合理的实践空间。",
      "reversed": "家人对能力的急切评断，可能让人失去尝试意愿。"
    },
    "mood": {
      "upright": "学习一件具体小事能给漂浮的情绪带来方向感。",
      "reversed": "因比较而觉得自己不够好时，记得允许起步阶段的生涩。"
    },
    "finance": {
      "upright": "可从认识收支、账单或基本金钱概念开始培养清楚感。",
      "reversed": "面对陌生的财务信息，先学习和核实，不凭想象判断。"
    },
    "growth": {
      "upright": "初学者的认真比装作熟练更能带来真实进展。",
      "reversed": "把犯错视为可分析的资料，而不是证明自己不行。"
    }
  },
  "editorial": {
    "status": "approved",
    "lastReviewedAt": "2026-07-21",
    "sourceNotes": "基于 Rider–Waite–Smith 象征体系编写的 Arcana 原创中文牌义；钱币花色，2026-07-21 代理审查后标记 approved。"
  }
}
