{
  "schemaVersion": "2.0",
  "contentVersion": "1.0.0",
  "id": "minor-pentacles-four",
  "arcana": "minor",
  "number": 4,
  "suit": "pentacles",
  "rank": "four",
  "name": {
    "zh": "钱币四",
    "en": "Four of Pentacles"
  },
  "core": {
    "summary": "男子紧抱钱币、脚踩两枚、头顶一枚，象征守护资源时的安全感与僵硬界限。",
    "symbols": [
      {
        "name": "怀中钱币",
        "meaning": "紧抱的姿势表现对失去的担心与拥有的执着。"
      },
      {
        "name": "头顶钱币",
        "meaning": "压在头上的钱币暗示固守也会限制视野。"
      },
      {
        "name": "脚下双币",
        "meaning": "双脚踩住资源，象征稳定感可能建立在不愿流动上。"
      },
      {
        "name": "远方城镇",
        "meaning": "背后的城市提醒人与社群仍在资源之外提供归属。"
      }
    ],
    "element": "土"
  },
  "upright": {
    "keywords": [
      "守护",
      "边界",
      "稳定",
      "占有"
    ],
    "overview": "钱币被牢牢固定在身体周围，正位指向保存、设限与珍惜已有之物的需求。它能帮助你稳住根基，也提醒你观察保护是否已变成无法呼吸的控制。",
    "light": "清楚自己的底线和可用资源，会使承诺更审慎而可靠。",
    "shadow": "害怕失去时，可能把人、时间或物品都当作必须紧抓的保障。",
    "advice": [
      "辨认一项需要保留的资源和一项可以适度流动的资源。",
      "为自己的界限说明理由，而不是只用拒绝回应。"
    ],
    "reflection": "你在守护什么，又害怕它如何离开？"
  },
  "reversed": {
    "keywords": [
      "松动",
      "失控感",
      "慷慨困难",
      "执着"
    ],
    "overview": "逆位让紧握的姿态开始松开，可能带来释放，也可能显出失序。它邀请你检视囤积、控制或过度节省背后的不安，并建立比抓紧更可靠的支持方式。",
    "light": "愿意重新分配空间与责任，能让关系和生活恢复流动。",
    "shadow": "若在压力下突然放弃所有界限，之后容易感到更深的空虚或后悔。",
    "advice": [
      "从一个低风险领域练习分享、整理或放手。",
      "保留必要缓冲，同时避免用占有确认自我价值。"
    ],
    "reflection": "哪一道界限该被调整，而非完全拆除？"
  },
  "topics": {
    "love": {
      "upright": "稳定关系需要清楚边界，也需要让亲近感有进出的空间。",
      "reversed": "过度确认或控制行程时，安全感反而会变成压力。"
    },
    "career": {
      "upright": "可守住工作节奏与专业范围，避免无止境地承担额外责任。",
      "reversed": "害怕失去位置可能让你拒绝协作或不愿传递知识。"
    },
    "family": {
      "upright": "家庭资源的使用适合订出透明规则，减少猜测。",
      "reversed": "旧有的占有感被触动时，先谈担忧而不是翻旧帐。"
    },
    "mood": {
      "upright": "整理物品和环境会带来安定，但不必把秩序当成唯一安慰。",
      "reversed": "强烈的不安全感出现时，找可信的人谈谈比独自收紧更有帮助。"
    },
    "finance": {
      "upright": "可观察自己保存金钱的动机，是规划、恐惧还是两者交织。",
      "reversed": "对支出过度紧绷时，先区分必要保护与限制生活的担忧。"
    },
    "growth": {
      "upright": "练习拥有而不被拥有定义，是成熟的稳定感。",
      "reversed": "放手不等于失去价值，可从小范围体验弹性。"
    }
  },
  "editorial": {
    "status": "approved",
    "lastReviewedAt": "2026-07-21",
    "sourceNotes": "基于 Rider–Waite–Smith 象征体系编写的 Arcana 原创中文牌义；钱币花色，2026-07-21 代理审查后标记 approved。"
  }
}
