{
  "schemaVersion": "2.0",
  "contentVersion": "1.1.0",
  "id": "major-04",
  "arcana": "major",
  "number": 4,
  "romanNumeral": "IV",
  "name": {
    "zh": "皇帝",
    "en": "The Emperor"
  },
  "core": {
    "summary": "结构、责任与清晰边界为长期行动提供稳定",
    "symbols": [
      {
        "name": "石座",
        "meaning": "端坐的石制王座，象征稳固秩序，也提醒权威若不流动可能变得僵硬。"
      },
      {
        "name": "公羊头",
        "meaning": "座椅四角的公羊头饰，对应白羊座，代表主动、勇气与领导意志。"
      },
      {
        "name": "铠甲",
        "meaning": "长袍下隐约可见的铠甲，显示保护意识与随时承担责任的准备。"
      },
      {
        "name": "山脉",
        "meaning": "背景连绵的荒芜山脉，代表严峻的现实条件与坚定不移的原则。"
      }
    ],
    "element": "火"
  },
  "upright": {
    "keywords": [
      "结构",
      "边界",
      "承担责任",
      "长期规划"
    ],
    "overview": "皇帝正位适合为正在推进的事情建立清楚的框架：谁负责什么、规则是什么、下一次检查在什么时候。稳定不是限制自由，而是让长期的投入有明确的方向可以依循，不必每一步都重新协商。",
    "light": "清楚的边界和规则能减少反复的协商成本，让每个人知道自己站在什么位置上。",
    "shadow": "把秩序当成控制局面的唯一方式，容易忽略规则本该服务的人和目标。",
    "advice": [
      "为当前推进的事情写下一条明确规则、一个负责人和一个复核时间。",
      "检查现有的某条规定是否还符合实际需要，若不再适用就主动调整。"
    ],
    "reflection": "你设立的这条边界，是为了让事情更清楚，还是为了让自己更有安全感？"
  },
  "reversed": {
    "keywords": [
      "僵化",
      "过度控制",
      "权责不对等",
      "抗拒示弱"
    ],
    "overview": "皇帝逆位常出现在规则已经变成束缚，或者掌握权力的人不愿承担相应责任的时候。过度控制局面反而消耗更多精力，也可能是在用强硬的态度，掩盖内心对失控和被质疑的不安与担忧。",
    "light": "察觉自己在某件事上握得太紧，是重新评估哪些控制真正必要的开始。",
    "shadow": "坚持既有做法只是为了不显得软弱，最终会让团队或关系失去调整的空间。",
    "advice": [
      "找出一条你坚持却说不清理由的规则，问问它现在还服务谁的利益。",
      "在一件小事上主动放权或调整安排，观察结果是否真的比你预期的更失控。"
    ],
    "reflection": "如果放松一点控制，你最担心会发生什么？"
  },
  "topics": {
    "love": {
      "upright": "关系里适合明确表达自己的需要和底线，清楚的边界反而能让彼此更安心地靠近。",
      "reversed": "留意关系中是否有一方总在主导决定。稳定的感情需要双方都有发言权，不只是听从安排。"
    },
    "career": {
      "upright": "适合把职责范围和工作流程理清楚，明确的分工能让长期项目走得更稳。",
      "reversed": "如果规则或层级已经让工作效率下降，值得提出调整，而不是继续硬性执行。"
    },
    "family": {
      "upright": "家庭事务适合建立清楚的分工和作息安排，稳定的结构能减少日常摩擦。",
      "reversed": "家中的规矩若只由一人制定、不容讨论，容易让其他成员感到被忽视或压抑。"
    },
    "mood": {
      "upright": "建立一些稳定的日常习惯，比如固定的作息或运动，能帮助情绪找到可依靠的框架。",
      "reversed": "如果你一直用强撑来维持表面的稳定，值得留意这份紧绷背后真正的疲惫。"
    },
    "finance": {
      "upright": "适合建立明确的预算规则和记账习惯，用稳定的制度而非临时决定管理资源。",
      "reversed": "过度严格的预算限制若已经引发压力或冲突，可以考虑调整比例，而非全盘坚持。"
    },
    "growth": {
      "upright": "这个阶段适合练习为自己设定清楚的目标和检查节点，用结构支撑持续的进步。",
      "reversed": "如果你一直靠强硬的自我要求推动成长，试着留一些空间给弹性和意外。"
    }
  },
  "editorial": {
    "status": "approved",
    "lastReviewedAt": "2026-07-21",
    "sourceNotes": "基于 Rider–Waite–Smith 象征体系编写的 Arcana 原创中文牌义；2026-07-21 完成代理内容审查与合规润色，标记为 approved。"
  }
}
