{
  "schemaVersion": "2.0",
  "contentVersion": "1.0.0",
  "id": "minor-swords-eight",
  "arcana": "minor",
  "number": 8,
  "suit": "swords",
  "rank": "eight",
  "name": {
    "zh": "宝剑八",
    "en": "Eight of Swords"
  },
  "core": {
    "summary": "蒙眼者被松绑缚、围于八剑之间，象征受限感、恐惧性思维与仍可寻找的行动缝隙。",
    "symbols": [
      {
        "name": "松绑缚带",
        "meaning": "束缚并未完全收紧，提示限制中仍可能存在可用的选择。"
      },
      {
        "name": "蒙眼人物",
        "meaning": "眼罩象征看不见全貌，也可能是被恐惧遮住的判断。"
      },
      {
        "name": "环绕八剑",
        "meaning": "竖立的剑形成心理围栏，代表反复出现的限制性念头。"
      },
      {
        "name": "泥泞地面",
        "meaning": "湿地显示行动不易，却不表示无法小心地移动。"
      }
    ],
    "element": "风"
  },
  "upright": {
    "keywords": [
      "受限感",
      "自我怀疑",
      "观察选择",
      "松绑"
    ],
    "overview": "宝剑八呈现觉得无路可走的时刻。它并不否认现实限制，而是邀请你辨认哪些来自环境，哪些是恐惧或旧叙事加上的围栏，再从最安全可行的一步试着松动。",
    "light": "你开始把困境说清楚，便能看见先前未被注意到的资源与选择。",
    "shadow": "持续相信自己毫无能力，可能使外在限制和内在恐惧彼此强化。",
    "advice": [
      "写下限制、证据与可求助的资源。",
      "选择一件风险低的小事，测试是否真如想象般无路。"
    ],
    "reflection": "哪一道限制可以先被具体检验？"
  },
  "reversed": {
    "keywords": [
      "松绑",
      "视野打开",
      "仍有恐惧",
      "采取行动"
    ],
    "overview": "逆位表示束缚感正在被辨认，或你已准备尝试离开旧有框架。改变不需一次到位；以安全、支持和可重复的小行动，逐渐把选择感带回生活。",
    "light": "你愿意摘下部分眼罩，开始相信自己可以参与改变。",
    "shadow": "急于证明自由而忽略现实风险，可能让压力换一种形式回来。",
    "advice": [
      "为下一步准备必要支持与备用方案。",
      "庆祝一个已经松开的限制，而不否认仍有困难。"
    ],
    "reflection": "你愿意为自己争取哪一点空间？"
  },
  "topics": {
    "love": {
      "upright": "关系里感到被困时，先说出具体界限或需求，并评估是否有安全支持。",
      "reversed": "开始松动旧模式后，用持续的小改变建立更能呼吸的相处方式。"
    },
    "career": {
      "upright": "工作受限时，区分制度、技能与自我怀疑，找一项可先改善的条件。",
      "reversed": "职业选择变多时，先设定现实步骤，不必用仓促跳跃证明自己。"
    },
    "family": {
      "upright": "家庭角色让人窒息时，可寻找可信盟友，逐步讨论责任和个人空间。",
      "reversed": "旧有分工松动后，及时把新界限说清楚，减少彼此猜测。"
    },
    "mood": {
      "upright": "焦虑让选择看似消失时，先回到呼吸、身体和可确认的当下事实。",
      "reversed": "感到有一点掌控感后，继续温和练习，不要求恐惧立刻消失。"
    },
    "finance": {
      "upright": "财务压力出现时，观察恐惧怎样放大无力感，先核对现况与可用支持。",
      "reversed": "开始整理金钱选择时，分步骤记录和咨询，避免因急切增加负担。"
    },
    "growth": {
      "upright": "识别限制性信念，是把思维从牢笼转成工具的练习。",
      "reversed": "每一次安全的尝试都会扩大选择感，让改变逐渐变得可信。"
    }
  },
  "editorial": {
    "status": "approved",
    "lastReviewedAt": "2026-07-21",
    "sourceNotes": "基于 Rider–Waite–Smith 象征体系编写的 Arcana 原创中文牌义；宝剑花色，2026-07-21 代理审查后标记 approved。"
  }
}
