{
  "schemaVersion": "2.0",
  "contentVersion": "1.0.0",
  "id": "minor-wands-page",
  "arcana": "minor",
  "number": 11,
  "suit": "wands",
  "rank": "page",
  "name": {
    "zh": "权杖侍从",
    "en": "Page of Wands"
  },
  "core": {
    "summary": "年轻侍从在荒地端详开花权杖，以好奇和试探迎接一则尚未展开的热情讯息。",
    "symbols": [
      {
        "name": "远望权杖",
        "meaning": "侍从双手捧杖凝视顶端，象征好奇驱动的探索刚开始。"
      },
      {
        "name": "羽毛帽子",
        "meaning": "帽上羽毛提示轻盈与学习姿态，不必假装已经成熟。"
      },
      {
        "name": "沙漠旅人",
        "meaning": "荒原背景对应离开熟悉地带，用新经验更新地图。"
      },
      {
        "name": "直立权杖",
        "meaning": "权杖竖直如信号柱，提醒把灵感说清楚比收藏更重要。"
      }
    ],
    "element": "火"
  },
  "upright": {
    "keywords": [
      "好奇",
      "讯息",
      "探索",
      "热情"
    ],
    "overview": "一个新邀请或想法值得轻快地接近，也要让好奇接受现实的练习。 此时适合把感受、条件与行动顺序逐一厘清，再作回应。",
    "light": "「好奇」的力量让你更能把经验转成清晰行动，并带动周围的节奏。",
    "shadow": "若过度执着于「好奇」，容易忽略资源限制、他人感受或后续安排。",
    "advice": [
      "围绕「好奇」选择一项今天可完成的具体行动。"
    ],
    "reflection": "什么消息让你重新感到好奇？"
  },
  "reversed": {
    "keywords": [
      "不成熟",
      "消息延迟",
      "三分钟热度",
      "表达受阻"
    ],
    "overview": "兴奋可能被不安压住，或因缺乏基础而难以把想法讲清。 此时适合把感受、条件与行动顺序逐一厘清，再作回应。",
    "light": "看见「不成熟」能帮助你暂停修正，重新找到较合适的步幅。",
    "shadow": "若放任「不成熟」持续发展，可能让焦虑、误解或压力不断累积。",
    "advice": [
      "先处理与「不成熟」最相关的一项事实，再决定下一步。"
    ],
    "reflection": "你愿意允许自己在哪方面还不熟练？"
  },
  "topics": {
    "love": {
      "upright": "关系中可借「好奇」看清当下需要，以具体沟通和行动维持自己的节奏。",
      "reversed": "关系出现「不成熟」时，先核实事实与边界，再选择可承受的调整方式。"
    },
    "career": {
      "upright": "工作中可借「好奇」看清当下需要，以具体沟通和行动维持自己的节奏。",
      "reversed": "工作出现「不成熟」时，先核实事实与边界，再选择可承受的调整方式。"
    },
    "family": {
      "upright": "家庭中可借「好奇」看清当下需要，以具体沟通和行动维持自己的节奏。",
      "reversed": "家庭出现「不成熟」时，先核实事实与边界，再选择可承受的调整方式。"
    },
    "mood": {
      "upright": "情绪中可借「好奇」看清当下需要，以具体沟通和行动维持自己的节奏。",
      "reversed": "情绪出现「不成熟」时，先核实事实与边界，再选择可承受的调整方式。"
    },
    "finance": {
      "upright": "财务中可借「好奇」看清当下需要，以具体沟通和行动维持自己的节奏。",
      "reversed": "财务出现「不成熟」时，先核实事实与边界，再选择可承受的调整方式。"
    },
    "growth": {
      "upright": "成长中可借「好奇」看清当下需要，以具体沟通和行动维持自己的节奏。",
      "reversed": "成长出现「不成熟」时，先核实事实与边界，再选择可承受的调整方式。"
    }
  },
  "editorial": {
    "status": "approved",
    "lastReviewedAt": "2026-07-21",
    "sourceNotes": "基于 Rider–Waite–Smith 象征体系编写的 Arcana 原创中文牌义；权杖花色首批，2026-07-21 代理审查后标记 approved。"
  }
}
