{
  "schemaVersion": "2.0",
  "contentVersion": "1.0.0",
  "id": "major-09",
  "arcana": "major",
  "number": 9,
  "romanNumeral": "IX",
  "name": {
    "zh": "隐士",
    "en": "The Hermit"
  },
  "core": {
    "summary": "有意识的独处让经验沉淀为可信内在指引",
    "symbols": [
      {
        "name": "灯笼",
        "meaning": "象征只照亮眼前一步的内在智慧。"
      },
      {
        "name": "手杖",
        "meaning": "代表经验、支持与孤独道路上的稳定。"
      },
      {
        "name": "灰袍",
        "meaning": "象征退离外界评价并专注本质。"
      },
      {
        "name": "雪山",
        "meaning": "代表通过耐心与历练获得的视野。"
      }
    ],
    "element": "土"
  },
  "upright": {
    "keywords": [
      "独处",
      "内在指引",
      "深思",
      "成熟经验"
    ],
    "overview": "暂时远离喧闹能够帮助你听见自己的判断，此刻需要深度，而不是更多意见。 你可以在保持开放的同时，以具体行动观察反馈，让这股力量逐步进入现实。",
    "light": "独处能帮助你整合经验，在不急于确定结果时看见更多可能。",
    "shadow": "若过度依赖内在指引，可能忽略现实边界、他人感受或自身真正需要。",
    "advice": [
      "围绕“独处”选择一项今天能够完成、并可观察反馈的小行动。",
      "检查“内在指引”如何影响当前选择，为调整方向保留清晰空间。"
    ],
    "reflection": "如果不要求一次做对，你会怎样实践“独处”？"
  },
  "reversed": {
    "keywords": [
      "孤立",
      "逃避交流",
      "迷失",
      "过度内省"
    ],
    "overview": "独处可能已从整理自己变成切断连接，长时间困在思考中也可能让方向更加模糊。 逆位并非正位的简单反面，而是邀请你辨认阻力的来源，并恢复更有意识的选择。",
    "light": "看见孤立的具体表现，能让停顿成为校准边界与动机的机会。",
    "shadow": "若长期困在逃避交流之中，可能让自我保护变成消耗，并加深原有失衡。",
    "advice": [
      "把“孤立”拆成事实、感受与可调整部分，先处理最具体的一项。",
      "为当前决定设置复核时间，避免在“逃避交流”中无限停留。"
    ],
    "reflection": "“孤立”正在保护你免于面对什么不确定性？"
  },
  "topics": {
    "love": {
      "upright": "关系中可把“独处、内在指引”视为当前练习：保持坦诚，让承诺随真实了解逐步形成。",
      "reversed": "关系里的“孤立、逃避交流”值得被看见。先澄清需要与边界，再判断能否共同调整。"
    },
    "career": {
      "upright": "工作上适合围绕“独处、内在指引”推进，用可验证的小行动连接目标、资源与反馈。",
      "reversed": "职业处境中的“孤立、逃避交流”可能消耗判断。缩小范围、补充信息，再决定下一步。"
    },
    "family": {
      "upright": "家庭互动可从“独处、内在指引”获得启发。说明实际需要与分工，给彼此留下回应空间。",
      "reversed": "家人之间的“孤立、逃避交流”可能掩盖担忧。先处理边界与现实安排，不急于定性。"
    },
    "mood": {
      "upright": "内在可能正在经历“独处、内在指引”。允许感受存在，并选择让能量稳定流动的小动作。",
      "reversed": "“孤立、逃避交流”可能让情绪紧绷。先照顾身体与节奏，再辨认真正需要回应的问题。"
    },
    "finance": {
      "upright": "财务上可借“独处、内在指引”审视预算与资源，以可承受、可复核的步骤行动，不把可能性当收益保证。",
      "reversed": "面对“孤立、逃避交流”，应核对数字、预算与风险范围；重要金钱决定可寻求合格专业意见。"
    },
    "growth": {
      "upright": "成长可围绕“独处、内在指引”展开：通过实践观察自己，不要求一次得到完整答案。",
      "reversed": "成长中的“孤立、逃避交流”不是失败标签。辨认它保护了什么，再选择符合当下价值的练习。"
    }
  },
  "editorial": {
    "status": "draft",
    "lastReviewedAt": null,
    "sourceNotes": "基于 Rider–Waite–Smith 象征体系编写的 Arcana 原创中文草稿，待独立内容审核。"
  }
}
