{
  "schemaVersion": "2.0",
  "contentVersion": "1.0.0",
  "id": "minor-pentacles-ace",
  "arcana": "minor",
  "number": 1,
  "suit": "pentacles",
  "rank": "ace",
  "name": {
    "zh": "钱币王牌",
    "en": "Ace of Pentacles"
  },
  "core": {
    "summary": "云中伸出的手托起一枚钱币，象征可被照料的资源、身体感与踏实的新起点。",
    "symbols": [
      {
        "name": "云中之手",
        "meaning": "手掌递出具体机会，提醒价值需要落到可触摸的行动。"
      },
      {
        "name": "金色钱币",
        "meaning": "五芒星钱币代表资源、身体与技能所形成的现实基础。"
      },
      {
        "name": "繁花庭园",
        "meaning": "盛开的花墙说明丰盛来自持续照料，而不是偶然降临。"
      },
      {
        "name": "山间小径",
        "meaning": "远处山道提示任何稳固成果都需要逐步抵达。"
      }
    ],
    "element": "土"
  },
  "upright": {
    "keywords": [
      "萌芽",
      "资源",
      "落实",
      "身体感"
    ],
    "overview": "一枚钱币落入手中，像是一个可以培养的现实种子。正位关注工作、健康习惯或居住安排中能慢慢扎根的机会，并邀请你以耐心确认它是否符合真实需要。",
    "light": "你能把抽象愿望转成可安排的时间、空间或技能练习，安全感随之增加。",
    "shadow": "若只看见结果的光泽，容易忽略维护资源所需的精力与边界。",
    "advice": [
      "为新计划列出最小的时间和材料需求。",
      "留意身体对这项机会给出的舒适或紧绷讯号。"
    ],
    "reflection": "什么值得你用日常行动慢慢培育？"
  },
  "reversed": {
    "keywords": [
      "错失",
      "不稳",
      "价值怀疑",
      "资源闲置"
    ],
    "overview": "逆位显示眼前的可能性尚未被接住，或条件看似充足却难以落地。它提醒你分辨是准备不足、价值感摇摆，还是把希望寄托在不适合自己的形式上。",
    "light": "暂停承诺能让你重新评估条件，避免为了拥有而接下负担。",
    "shadow": "过度担心匮乏可能使可用资源被搁置，也可能让你低估自己的劳动。",
    "advice": [
      "盘点已有工具、时间和支持，而非只盯着缺口。",
      "把一个大目标缩小为可在本周验证的步骤。"
    ],
    "reflection": "你把哪一种可能误认为必须立刻抓住？"
  },
  "topics": {
    "love": {
      "upright": "关系可从共享日常、照顾身体或讨论生活节奏中建立可靠感。",
      "reversed": "若安全感被物质条件绑住，需听见彼此真正想被理解的需要。"
    },
    "career": {
      "upright": "适合开始一项能积累技能的任务，让成果在重复练习中看得见。",
      "reversed": "工作机会尚不清楚时，先确认职责与可投入的现实条件。"
    },
    "family": {
      "upright": "家中可通过整理空间或共同处理一件实际事务恢复踏实感。",
      "reversed": "家庭对资源的担忧容易放大，宜分别说出事实和各自感受。"
    },
    "mood": {
      "upright": "把注意力放回呼吸、饮食和睡眠，有助于情绪重新着地。",
      "reversed": "心神飘忽时，不必强求立刻振作，先找到一件可完成的小事。"
    },
    "finance": {
      "upright": "可观察新出现的收入、支出或储蓄线索是否和长期需要一致。",
      "reversed": "面对金钱机会时，先核对条款与可承受范围，避免用焦虑填补空白。"
    },
    "growth": {
      "upright": "从照料一项具体习惯开始，会让自我信任更有根基。",
      "reversed": "当成长看不见成果时，回顾已完成的细小累积。"
    }
  },
  "editorial": {
    "status": "approved",
    "lastReviewedAt": "2026-07-21",
    "sourceNotes": "基于 Rider–Waite–Smith 象征体系编写的 Arcana 原创中文牌义；钱币花色，2026-07-21 代理审查后标记 approved。"
  }
}
