{"schemaVersion":"2.0","contentVersion":"1.0.0","id":"minor-swords-six","arcana":"minor","number":6,"suit":"swords","rank":"six","name":{"zh":"宝剑六","en":"Six of Swords"},"core":{"summary":"小舟载着人们渡过水面，六剑静立船中，象征过渡、带着经验离开困扰并寻找较平静的岸。","symbols":[{"name":"渡河小舟","meaning":"船的移动表示转变是过程，不要求马上抵达理想状态。"},{"name":"披斗篷者","meaning":"低头的乘客承载未尽情绪，提醒改变并非遗忘。"},{"name":"船中六剑","meaning":"随行的剑表示经验和想法会被带往下一段路。"},{"name":"远方岸线","meaning":"较平静的水域象征可望获得喘息的新环境。"}],"element":"风"},"upright":{"keywords":["过渡","离开困扰","缓和","前行"],"overview":"宝剑六描绘从动荡水域驶向较平静处的过渡。正位支持你以务实方式调整环境、关系或思考习惯；不必否认过去的重量，但可以为自己选择更可呼吸的方向。","light":"你能带着经验前行，而不让旧事决定接下来每一步。","shadow":"若只改变地点却不整理模式，困扰可能以新的形式继续跟随。","advice":["确认目前最需要减少的一种消耗。","为转变安排一个可执行的支持或交接步骤。"],"reflection":"什么正在帮助你驶向较平静的水域？"},"reversed":{"keywords":["过渡受阻","旧事牵扯","抗拒改变","反复回望"],"overview":"逆位表示离开的过程并不顺畅，可能有实际限制，也可能是旧有想法持续拉住你。先接纳过渡有来回，再区分眼下真正需要处理的事项与习惯性的担忧。","light":"看见自己仍在牵挂什么，有助于把转变安排得更周全。","shadow":"不断回望或仓促逃离，都可能让新的选择缺少稳固基础。","advice":["列出转变中可控制与暂时无法控制的因素。","向可靠的人说明你需要的实际协助。"],"reflection":"是哪一种未完成的事让你难以前进？"},"topics":{"love":{"upright":"关系经历波动后，可一起调整相处环境与节奏，为修复创造较安静的空间。","reversed":"若旧问题不断被带回，先找出触发模式，不把每次争执当成全新的事件。"},"career":{"upright":"工作转岗或收尾时，做好交接并保留经验，让变化有清楚的路径。","reversed":"职业转换受阻时，可把目标拆小，先处理最实际的技能、资料或支持。"},"family":{"upright":"家庭处在变动期，可用明确日程和分工降低不确定带来的压力。","reversed":"家人对改变步调不同，先倾听各自顾虑，避免把沉默解读为拒绝。"},"mood":{"upright":"心绪沉重时，换一个安全的环境散步或休息，能帮助思考慢慢转向。","reversed":"若思绪总回到过去，可温和记录触发点，给自己当下可依靠的日常。"},"finance":{"upright":"可观察财务压力来源，并以逐步整理帐目和减少消耗来支持过渡。","reversed":"金钱变动让人不安时，先确认现况与缓冲空间，不急于追求一次解决。"},"growth":{"upright":"成长有时是离开熟悉却耗损的叙事，带着学到的东西继续走。","reversed":"练习允许进展有反复，把每次回头当作理解而非倒退。"}},"editorial":{"status":"approved","lastReviewedAt":"2026-07-21","sourceNotes":"基于 Rider–Waite–Smith 象征体系编写的 Arcana 原创中文牌义；宝剑花色，2026-07-21 代理审查后标记 approved。"}}
