{
  "schemaVersion": "2.0",
  "contentVersion": "1.0.0",
  "id": "minor-cups-king",
  "arcana": "minor",
  "number": 14,
  "suit": "cups",
  "rank": "king",
  "name": {
    "zh": "圣杯国王",
    "en": "King of Cups"
  },
  "core": {
    "summary": "国王稳坐漂浮王座并握权杖圣杯，在情绪起伏中展现成熟、平衡与仁慈",
    "symbols": [
      {
        "name": "漂浮王座",
        "meaning": "石座置于海面，表示稳定并非来自否认波动"
      },
      {
        "name": "手中圣杯",
        "meaning": "端稳的杯子象征对情感的承担与节制"
      },
      {
        "name": "海中船只",
        "meaning": "远处小船提示外界变化仍在持续发生"
      },
      {
        "name": "跃出海鱼",
        "meaning": "跃鱼代表无意识内容会偶尔进入意识视野"
      }
    ],
    "element": "水"
  },
  "upright": {
    "keywords": [
      "成熟平衡",
      "稳定回应",
      "承认波动",
      "直觉"
    ],
    "overview": "国王稳坐漂浮王座并握权杖圣杯，在情绪起伏中展现成熟、平衡与仁慈。正位时，成熟平衡不是只凭一时感动，而是愿意辨认自己与他人的需要，并用恰当的表达让关系或内在体验继续流动。",
    "light": "你能从细微感受中获得方向，并让稳定回应成为靠近自己或他人的桥梁。",
    "shadow": "若只追逐情绪高点，成熟平衡也可能忽略边界、节奏或尚待确认的事实。",
    "advice": [
      "围绕沉着沟通安排一次具体而温和的行动。",
      "先说清自己的感受，再听完对方的回应。"
    ],
    "reflection": "此刻的成熟平衡希望你如何被认真对待？"
  },
  "reversed": {
    "keywords": [
      "压抑操控",
      "冷淡控制",
      "情绪回流",
      "界限模糊"
    ],
    "overview": "国王稳坐漂浮王座并握权杖圣杯，在情绪起伏中展现成熟、平衡与仁慈。逆位把注意力带向压抑操控：感受可能被压下、放大或绕开了真正的问题；先辨认触发点，才能选择贴近自己的回应。",
    "light": "看见压抑操控能让你停止勉强配合，重新安排情感与精力的去向。",
    "shadow": "长期停在压抑操控里，容易让误解累积，或以沉默和想象代替实际沟通。",
    "advice": [
      "为压抑操控留出命名与整理的时间。",
      "把猜测改写成一个可以询问的问题。"
    ],
    "reflection": "你正在保护自己，还是被旧有感受牵住？"
  },
  "topics": {
    "love": {
      "upright": "感情中，成熟平衡时可以坦诚的方式表达期待，也尊重双方靠近的速度，让感受与现实安排保持清楚的联系。",
      "reversed": "亲密关系中，压抑操控时可暂停投射或冷处理，先确认彼此真正听见了什么，让感受与现实安排保持清楚的联系。"
    },
    "career": {
      "upright": "工作协作中，成熟平衡时可用同理和清晰沟通理解团队需要，再决定投入方式，让感受与现实安排保持清楚的联系。",
      "reversed": "职场互动中，压抑操控时可区分个人感受与工作事实，避免在委屈中替人承担，让感受与现实安排保持清楚的联系。"
    },
    "family": {
      "upright": "家庭相处中，成熟平衡时可通过一件关照彼此的日常小事增进理解，让感受与现实安排保持清楚的联系。",
      "reversed": "家人沟通中，压抑操控时可让难以启齿的感受有安全的表达时机，让感受与现实安排保持清楚的联系。"
    },
    "mood": {
      "upright": "情绪状态中，成熟平衡时可允许感受被体验，并用写作、音乐或安静散步帮助流动，让感受与现实安排保持清楚的联系。",
      "reversed": "内在情绪中，压抑操控时可先照顾休息与身体感受，不急着给自己下结论，让感受与现实安排保持清楚的联系。"
    },
    "finance": {
      "upright": "财务感受上，可观察成熟平衡是否影响消费期待，并记录让自己安心的支出边界。",
      "reversed": "财务焦虑出现压抑操控时，先回看预算与实际需求，不用消费来填补情绪空缺。"
    },
    "growth": {
      "upright": "个人成长中，成熟平衡时可练习把直觉转成可被检验和实践的选择，让感受与现实安排保持清楚的联系。",
      "reversed": "自我探索中，压抑操控时可辨认哪些旧故事仍在影响你对自己的判断，让感受与现实安排保持清楚的联系。"
    }
  },
  "editorial": {
    "status": "approved",
    "lastReviewedAt": "2026-07-21",
    "sourceNotes": "基于 Rider–Waite–Smith 象征体系编写的 Arcana 原创中文牌义；圣杯花色，2026-07-21 代理审查后标记 approved。"
  }
}
