{"schemaVersion":"2.0","contentVersion":"1.0.0","id":"minor-swords-queen","arcana":"minor","number":13,"suit":"swords","rank":"queen","name":{"zh":"宝剑王后","en":"Queen of Swords"},"core":{"summary":"王后端坐云间王座，右手持剑、左手伸出，象征洞察、坦率与带有边界的清醒关怀。","symbols":[{"name":"直立宝剑","meaning":"向上的剑代表清晰判断与不愿粉饰事实的表达。"},{"name":"伸出左手","meaning":"开放的手势显示坦率并非冷酷，仍愿意接纳真实交流。"},{"name":"云上王座","meaning":"高处王座象征宽阔视野，也提醒不要脱离具体人的处境。"},{"name":"飞鸟天空","meaning":"空中鸟群呈现独立思考与自由判断的空间。"}],"element":"风"},"upright":{"keywords":["洞察","坦率","边界","独立"],"overview":"宝剑王后以清醒和诚实面对复杂情境。正位鼓励你辨别事实、说出必要的话，并在同理与界限之间保持平衡；清楚不是拒人于千里，而是让关系少一些含混。","light":"你能以准确语言看见核心，同时尊重他人的自主与尊严。","shadow":"若只强调理性正确，可能让关怀听起来像审判或距离。","advice":["用具体事实说明立场，再表达你重视的关系。","为不愿承担的事设下简洁而稳定的界限。"],"reflection":"你怎样既保持清楚，也保持人情温度？"},"reversed":{"keywords":["苛刻","疏离","偏见","重新倾听"],"overview":"逆位提醒清醒可能被疲惫、旧伤或防御变得过于锋利。先检查自己是否只在寻找证据支持已有判断，再让不同经验有机会补充你所看见的全貌。","light":"发现表达太硬后，你仍可选择修正语气和重新聆听。","shadow":"以讽刺、冷淡或过度批评保护自己，容易把需要的支持推远。","advice":["在给出判断前，先复述对方的重点确认理解。","把一项批评改写成具体请求或界限。"],"reflection":"哪一种防御正在让你的话失去温度？"},"topics":{"love":{"upright":"关系中适合清楚表达标准与需求，让亲近建立在尊重和真实之上。","reversed":"若对方感到被评判，先听完其经验，再讨论仍需坚持的界限。"},"career":{"upright":"工作上可用客观分析和直接沟通厘清责任，帮助团队作出清楚决定。","reversed":"职场反馈过于尖锐时，检查是否遗漏背景，并把评价转为可执行建议。"},"family":{"upright":"家庭中可温和但坚定地说明底线，让照顾不等于放弃自己的空间。","reversed":"旧有误解使你想疏离时，选择一个安全话题重新练习倾听。"},"mood":{"upright":"思绪清明时，适合整理价值与界限，分辨哪些要求并不属于自己。","reversed":"内在批评声很强时，尝试以对朋友的语气对待自己。"},"finance":{"upright":"可用清晰记录和独立判断观察财务安排，不让人情压力遮住自身边界。","reversed":"金钱问题引发苛责时，先回到事实与需求，避免用羞耻推动选择。"},"growth":{"upright":"培养辨析力与诚实表达，能使你更稳定地站在自己的价值上。","reversed":"练习让理性与慈悲同行，避免把成长变成持续审判自己。"}},"editorial":{"status":"approved","lastReviewedAt":"2026-07-21","sourceNotes":"基于 Rider–Waite–Smith 象征体系编写的 Arcana 原创中文牌义；宝剑花色，2026-07-21 代理审查后标记 approved。"}}
