{
  "schemaVersion": "2.0",
  "contentVersion": "1.0.0",
  "id": "minor-pentacles-seven",
  "arcana": "minor",
  "number": 7,
  "suit": "pentacles",
  "rank": "seven",
  "name": {
    "zh": "钱币七",
    "en": "Seven of Pentacles"
  },
  "core": {
    "summary": "农夫倚着工具凝望果实，象征等待、评估与长期耕耘后的耐心盘点。",
    "symbols": [
      {
        "name": "倚杖农夫",
        "meaning": "停下观察的姿势代表劳动之后的评估时刻。"
      },
      {
        "name": "藤上钱币",
        "meaning": "逐渐成熟的果实象征成果有自己的生长周期。"
      },
      {
        "name": "耕作工具",
        "meaning": "留在地上的工具说明进展来自反复投入。"
      },
      {
        "name": "泥土田地",
        "meaning": "土地提醒回报受季节、条件与照料共同影响。"
      }
    ],
    "element": "土"
  },
  "upright": {
    "keywords": [
      "耐心",
      "评估",
      "耕耘",
      "延迟成果"
    ],
    "overview": "农夫没有立刻摘下所有果实，而是停下来衡量收成。正位说明长期投入正在累积，但此刻更适合检视方法、节奏与真正想收获的东西。",
    "light": "你能在尚未完全见效时继续投入，并从过程里学习调整。",
    "shadow": "只盯着慢速回报，可能使已完成的进展被轻易否定。",
    "advice": [
      "回顾近期投入产生的实际变化。",
      "决定下一轮耕耘要保留、停止或调整什么。"
    ],
    "reflection": "你等待的成果，是否仍值得现在的投入？"
  },
  "reversed": {
    "keywords": [
      "急躁",
      "回报失望",
      "方向重估",
      "停滞"
    ],
    "overview": "逆位表示等待已变成焦躁，或旧方法没有带来期待中的结果。它不要求你硬撑，而是邀请你诚实评估：需要的是更多时间，还是改换土壤与方式。",
    "light": "停止无效重复是一种成熟且节省心力的资源管理。",
    "shadow": "因害怕白费而继续投入，可能让失望不断扩大。",
    "advice": [
      "为一项长期目标设定重新评估的日期。",
      "区分可控制的努力与无法控制的结果。"
    ],
    "reflection": "你是在耐心等待，还是不敢承认方法需要改变？"
  },
  "topics": {
    "love": {
      "upright": "关系的信任需要时间沉淀，可一起回看彼此已经走过的路。",
      "reversed": "若长期等待没有回应，需讨论这段关系是否仍有共同方向。"
    },
    "career": {
      "upright": "适合复盘技能与项目成果，为下一阶段调整工作方法。",
      "reversed": "努力未被看见时，别急着自责，先检查目标和评价标准。"
    },
    "family": {
      "upright": "家庭计划需要耐心协调，阶段性检视能减少彼此误解。",
      "reversed": "旧期待久未实现时，允许家人重新谈论不同的可能。"
    },
    "mood": {
      "upright": "慢下来的观察能让情绪从急切中恢复尺度感。",
      "reversed": "焦虑催促结果时，可把注意力放回今天可完成的照料。"
    },
    "finance": {
      "upright": "可查看长期储蓄、支出习惯或收入变化的趋势，而非只看单次波动。",
      "reversed": "对进展失望时，重新评估目标和时间范围，避免冲动反应。"
    },
    "growth": {
      "upright": "把学习视为季节性的过程，会减少对立即证明自己的压力。",
      "reversed": "承认一条路不合适，能腾出空间给新的练习。"
    }
  },
  "editorial": {
    "status": "approved",
    "lastReviewedAt": "2026-07-21",
    "sourceNotes": "基于 Rider–Waite–Smith 象征体系编写的 Arcana 原创中文牌义；钱币花色，2026-07-21 代理审查后标记 approved。"
  }
}
