{
  "schemaVersion": "2.0",
  "contentVersion": "1.0.0",
  "id": "minor-wands-nine",
  "arcana": "minor",
  "number": 9,
  "suit": "wands",
  "rank": "nine",
  "name": {
    "zh": "权杖九",
    "en": "Nine of Wands"
  },
  "core": {
    "summary": "受伤的人仍握紧权杖，身后八根竖立，呈现经历消耗后保持警觉与韧性的状态。",
    "symbols": [
      {
        "name": "包扎战士",
        "meaning": "人物头部包扎仍握杖警戒，象征疲惫后仍保持边界意识。"
      },
      {
        "name": "权杖栅栏",
        "meaning": "身后竖立的权杖如防线，提示经验已筑成可依赖的保护。"
      },
      {
        "name": "警觉眼神",
        "meaning": "侧目注视来路，提醒休息不等于放下觉察。"
      },
      {
        "name": "受伤却站立",
        "meaning": "带伤站立呈现韧性：可以休息，但不必放弃立场。"
      }
    ],
    "element": "火"
  },
  "upright": {
    "keywords": [
      "警觉",
      "韧性",
      "经验",
      "守望"
    ],
    "overview": "你已走过不轻松的路，当前重点是用经验保护自己，同时避免把过去的伤变成关闭一切的理由。",
    "light": "「警觉」的力量让你更能把经验转成清晰行动，并带动周围的节奏。",
    "shadow": "若过度执着于「警觉」，容易忽略资源限制、他人感受或后续安排。",
    "advice": [
      "围绕「警觉」选择一项今天可完成的具体行动。"
    ],
    "reflection": "你需要的是再撑一下，还是先补给？"
  },
  "reversed": {
    "keywords": [
      "耗竭",
      "多疑",
      "防线过高",
      "旧伤触发"
    ],
    "overview": "疲劳让你更易把普通要求当作威胁，需要先照顾有限的精力。 此时适合把感受、条件与行动顺序逐一厘清，再作回应。",
    "light": "看见「耗竭」能帮助你暂停修正，重新找到较合适的步幅。",
    "shadow": "若放任「耗竭」持续发展，可能让焦虑、误解或压力不断累积。",
    "advice": [
      "先处理与「耗竭」最相关的一项事实，再决定下一步。"
    ],
    "reflection": "哪些旧经验仍在替你决定今天？"
  },
  "topics": {
    "love": {
      "upright": "关系中可借「警觉」看清当下需要，以具体沟通和行动维持自己的节奏。",
      "reversed": "关系出现「耗竭」时，先核实事实与边界，再选择可承受的调整方式。"
    },
    "career": {
      "upright": "工作中可借「警觉」看清当下需要，以具体沟通和行动维持自己的节奏。",
      "reversed": "工作出现「耗竭」时，先核实事实与边界，再选择可承受的调整方式。"
    },
    "family": {
      "upright": "家庭中可借「警觉」看清当下需要，以具体沟通和行动维持自己的节奏。",
      "reversed": "家庭出现「耗竭」时，先核实事实与边界，再选择可承受的调整方式。"
    },
    "mood": {
      "upright": "情绪中可借「警觉」看清当下需要，以具体沟通和行动维持自己的节奏。",
      "reversed": "情绪出现「耗竭」时，先核实事实与边界，再选择可承受的调整方式。"
    },
    "finance": {
      "upright": "财务中可借「警觉」看清当下需要，以具体沟通和行动维持自己的节奏。",
      "reversed": "财务出现「耗竭」时，先核实事实与边界，再选择可承受的调整方式。"
    },
    "growth": {
      "upright": "成长中可借「警觉」看清当下需要，以具体沟通和行动维持自己的节奏。",
      "reversed": "成长出现「耗竭」时，先核实事实与边界，再选择可承受的调整方式。"
    }
  },
  "editorial": {
    "status": "approved",
    "lastReviewedAt": "2026-07-21",
    "sourceNotes": "基于 Rider–Waite–Smith 象征体系编写的 Arcana 原创中文牌义；权杖花色首批，2026-07-21 代理审查后标记 approved。"
  }
}
