{
  "schemaVersion": "2.0",
  "contentVersion": "1.0.0",
  "id": "minor-swords-four",
  "arcana": "minor",
  "number": 4,
  "suit": "swords",
  "rank": "four",
  "name": {
    "zh": "宝剑四",
    "en": "Four of Swords"
  },
  "core": {
    "summary": "骑士在石墓上安卧，三剑悬墙、一剑在侧，象征暂停、休息与思绪复原。",
    "symbols": [
      {
        "name": "安卧骑士",
        "meaning": "静躺的身影表示主动撤离消耗，为身心留下恢复余地。"
      },
      {
        "name": "墙上三剑",
        "meaning": "悬挂的剑让外界冲突暂时退到背景，不必立刻回应。"
      },
      {
        "name": "身侧单剑",
        "meaning": "保留的一剑象征必要的警觉仍在，但不主导休息。"
      },
      {
        "name": "彩绘窗光",
        "meaning": "窗光带来安静的精神支持，提醒恢复也可来自价值与信念。"
      }
    ],
    "element": "风"
  },
  "upright": {
    "keywords": [
      "休息",
      "暂停",
      "复原",
      "沉静"
    ],
    "overview": "宝剑四建议把持续运转的头脑暂时放下。它不是消极退缩，而是在压力之后有意识地减少刺激、补充睡眠，并让下一步从较清楚的状态出发。",
    "light": "你愿意暂停，便能恢复判断力，并看见先前被忙碌盖住的优先次序。",
    "shadow": "若把隔离当作唯一方案，休息可能滑向与支持系统的长期断开。",
    "advice": [
      "为一天安排一段不处理任务的安静时段。",
      "暂停前明确哪些事项可延后，哪些需要交接。"
    ],
    "reflection": "什么样的休息能真正让你恢复？"
  },
  "reversed": {
    "keywords": [
      "难以休息",
      "过度隔离",
      "疲惫",
      "重新启动"
    ],
    "overview": "逆位常见于休息被打断，或已经停得太久而不知如何重启。先分辨是身体需要更多修复，还是担忧让你不敢回到生活节奏，再调低重新开始的门槛。",
    "light": "意识到疲惫本身，已是重新调整步调的重要讯号。",
    "shadow": "无止尽地逃离任务或强撑着继续，都可能使恢复变得更困难。",
    "advice": [
      "选择一项低耗能的事务作为重新启动。",
      "检查睡眠、讯息通知与工作边界是否需要调整。"
    ],
    "reflection": "你缺的是更多停顿，还是可承受的回归？"
  },
  "topics": {
    "love": {
      "upright": "关系节奏紧绷时，给彼此短暂空间和明确说明，休息不必等同冷淡。",
      "reversed": "若沉默已造成距离，可用温和讯息说明状态，并约定恢复联系的时机。"
    },
    "career": {
      "upright": "高强度工作后适合安排复盘与休整，让重要决定避开最疲惫的时段。",
      "reversed": "工作倦怠难缓解时，先减少非必要承诺，再讨论实际可行的支持。"
    },
    "family": {
      "upright": "家庭事务繁多时，可分配照料责任，为每个人保留不被打扰的时间。",
      "reversed": "家中有人长期退开时，关心其需要，但避免把催促包装成关怀。"
    },
    "mood": {
      "upright": "心绪嘈杂时，睡眠、安静和减少屏幕刺激能帮助思维慢慢沉静。",
      "reversed": "持续无法放松时，留意压力来源，并考虑与可信的人讨论支持方式。"
    },
    "finance": {
      "upright": "财务整理可暂缓冲动决定，先在清醒时核对资料与下一步。",
      "reversed": "若因压力回避帐目，可从最小的一笔记录开始，避免一次处理全部。"
    },
    "growth": {
      "upright": "把恢复看作成长的一部分，能帮助你不以持续产出衡量自身价值。",
      "reversed": "练习辨认逃避与休息的差别，为自己建立温和的行动节奏。"
    }
  },
  "editorial": {
    "status": "approved",
    "lastReviewedAt": "2026-07-21",
    "sourceNotes": "基于 Rider–Waite–Smith 象征体系编写的 Arcana 原创中文牌义；宝剑花色，2026-07-21 代理审查后标记 approved。"
  }
}
