{
  "schemaVersion": "2.0",
  "contentVersion": "1.0.0",
  "id": "major-00",
  "arcana": "major",
  "number": 0,
  "romanNumeral": "0",
  "name": {
    "zh": "愚人",
    "en": "The Fool"
  },
  "core": {
    "summary": "新的旅程、开放心态与未知可能",
    "symbols": [
      {
        "name": "悬崖",
        "meaning": "未知与风险就在脚下，提醒行动需要信任，也需要觉察。"
      },
      {
        "name": "白犬",
        "meaning": "代表本能、陪伴与即时提醒，是热情身边仍然清醒的声音。"
      },
      {
        "name": "包袱",
        "meaning": "轻装携带已经获得的经验，不让过去变成继续前进的负担。"
      },
      {
        "name": "太阳",
        "meaning": "照亮前路的生命力与乐观，让未知不仅是危险，也包含机会。"
      }
    ],
    "element": "风"
  },
  "upright": {
    "keywords": ["开始", "自由", "信任", "探索"],
    "overview": "愚人正位指向一个尚未被旧经验完全定义的新阶段。你可能还看不清完整路线，但已经感受到向前的召唤。它鼓励你保留好奇、允许尝试，并把注意力放在能够迈出的第一步，而不是要求自己提前控制所有结果。",
    "light": "开放与信任能让你看见过去忽略的可能，也更愿意通过真实体验学习。",
    "shadow": "乐观若缺少基本判断，可能变成忽视边界、低估代价或把责任留给以后。",
    "advice": [
      "选择一个今天能够完成的最小行动，用实际反馈代替反复设想。",
      "出发前确认最关键的一项风险，并为自己保留调整方向的空间。"
    ],
    "reflection": "如果不要求一次就做对，你愿意在哪件事上迈出第一步？"
  },
  "reversed": {
    "keywords": ["冒进", "迟疑", "准备不足", "逃避"],
    "overview": "愚人逆位常出现在想要改变却还没有找到合适步幅的时候。你可能因为兴奋而低估现实，也可能因为害怕犯错而一直停在起点。此时重点不是简单地前进或后退，而是分辨真正需要补足的准备，与只是让你拖延的担忧。",
    "light": "暂停可以帮助你重新辨认风险、动机和边界，让下一步更符合真实需要。",
    "shadow": "反复犹豫会把谨慎变成停滞，毫无准备地冲出去则可能让自由变成失控。",
    "advice": [
      "列出一个必须处理的现实风险和一个可以边做边学的问题，不要混为一谈。",
      "为决定设置明确的复核时间，避免无限等待所谓的完美时机。"
    ],
    "reflection": "你是在认真准备，还是借准备之名回避不确定性？"
  },
  "topics": {
    "love": {
      "upright": "关系中可能出现新的相识、相处方式或重新开始的机会。保持真诚和好奇，同时让承诺跟随了解逐步形成。",
      "reversed": "感情中的冲动或不确定正在放大。先确认双方期待与边界，再判断这是值得探索的新可能，还是对现实问题的回避。"
    },
    "career": {
      "upright": "新的岗位、项目或学习方向值得尝试。你不必掌握全部答案，但需要用一次可验证的小行动开始积累经验。",
      "reversed": "职业变化可能缺少信息、准备或清晰动机。检查风险并缩小试错成本，不要因一时兴奋做出难以撤回的承诺。"
    },
    "family": {
      "upright": "家庭关系中适合尝试更轻松、开放的沟通方式。放下预设角色，可能让彼此看到新的相处空间。",
      "reversed": "家人之间可能有人回避责任或对变化感到不安。先说清现实安排和各自边界，再讨论想要的自由。"
    },
    "mood": {
      "upright": "内在正在恢复活力与好奇心。允许自己做一点没有功利目标的新尝试，可能帮助情绪重新流动。",
      "reversed": "焦虑可能在冒进和停滞之间拉扯你。把模糊的不安写成具体问题，再区分哪些需要行动、哪些只需要被看见。"
    },
    "finance": {
      "upright": "财务上可以探索新的可能，但应从小规模、可承受的尝试开始。这张牌不支持忽略预算或把乐观当作收益保证。",
      "reversed": "警惕未经核实的信息、冲动消费或对风险的低估。涉及重要金钱决定时，应回到预算、事实与专业意见。"
    },
    "growth": {
      "upright": "成长来自允许自己成为初学者。选择一个真正好奇的方向，通过体验更新对自己能力和边界的认识。",
      "reversed": "你可能害怕显得不成熟，或不断用新鲜感逃开需要坚持的部分。辨认此刻需要的是开始、练习还是承担。"
    }
  },
  "editorial": {
    "status": "draft",
    "lastReviewedAt": null,
    "sourceNotes": "基于 Rider–Waite–Smith 象征体系编写的 Arcana 原创中文草稿，待独立内容审核。"
  }
}
