{
  "schemaVersion": "2.0",
  "contentVersion": "1.1.0",
  "id": "major-16",
  "arcana": "major",
  "number": 16,
  "romanNumeral": "XVI",
  "name": {
    "zh": "高塔",
    "en": "The Tower"
  },
  "core": {
    "summary": "突发揭示使不稳结构瓦解并暴露真实问题",
    "symbols": [
      {
        "name": "闪电",
        "meaning": "象征真相与改变突然突破长期维持的防线。"
      },
      {
        "name": "坠落王冠",
        "meaning": "提示虚假的掌控感和权威正在受到挑战。"
      },
      {
        "name": "坠落人物",
        "meaning": "呈现失控感，以及旧位置已经无法继续维持。"
      },
      {
        "name": "燃烧高塔",
        "meaning": "建立在脆弱基础上的结构，在这一刻彻底瓦解。"
      }
    ],
    "element": "火"
  },
  "upright": {
    "keywords": [
      "结构崩解",
      "真相显现",
      "突发冲击",
      "强迫觉醒"
    ],
    "overview": "高塔正位描绘的是一座早已建立在裂缝之上的结构，终于在某个具体事件中崩解——可能是一次谎言被拆穿、一份合同被撤销，或是一个身份认同突然站不住脚。冲击往往显得突然，但真正的原因通常已经存在很久，只是被表面的秩序和习惯性的忽视遮盖。这张牌不评判崩塌本身是好是坏，它标记的是：某个不可能永远维持的东西，终于不再需要被勉强撑住了。",
    "light": "崩解之后，那些之前被隐藏或粉饰的问题会第一次变得清晰可见，让你有机会基于事实重新决定。",
    "shadow": "如果只顾着抢救原来的样子而不承认结构已经出了问题，冲击带来的信息就会被浪费。",
    "advice": [
      "在冲击发生后，先确认人身安全和最基本的秩序，再评估到底哪些部分真正倒塌了。",
      "写下这次事件揭露出的一个具体事实，是你之前一直选择性忽略的。"
    ],
    "reflection": "如果这次崩塌提前发生，你反而躲开了什么更大的代价？"
  },
  "reversed": {
    "keywords": [
      "回避震荡",
      "延迟重建",
      "压住裂缝",
      "隐性风险"
    ],
    "overview": "高塔逆位描述的往往不是剧烈冲击被躲开，而是被推迟。你可能已经注意到某处结构出现裂缝——一段关系里反复出现的同一个问题，一个项目里被搪塞过去的风险——但选择用修补表面来代替真正的重建，希望这样能避开一次彻底的震荡。裂缝不会因为被暂时压住而消失；延迟处理有时会让后续整理更复杂，也更容易错过分阶段调整的窗口。",
    "light": "提前注意到裂缝，说明你有机会在冲击变得不可控之前，主动进行一次有计划的重建。",
    "shadow": "一再推迟必要的调整，可能让原本可以分阶段处理的问题，最终更集中、更难收拾地显露出来。",
    "advice": [
      "找出当前被你反复修补却没有真正解决的那一处具体裂缝，评估它现在的实际严重程度。",
      "为这次重建列出一个不依赖运气的具体步骤，而不是继续等待问题自己消失。"
    ],
    "reflection": "你正在推迟的这次重建，需要多大的代价才能真正开始？"
  },
  "topics": {
    "love": {
      "upright": "一段关系里长期被忽视的裂痕——比如价值观分歧或反复出现的信任问题——可能因为一次具体事件被彻底摆到台面上，无法再用一次沟通就轻易搪塞过去。",
      "reversed": "你可能已经感觉到关系哪里不对，却选择用暂时的甜言蜜语或表面和解压住问题，让真正的谈话一次次被推迟到下一次冲突再说。"
    },
    "career": {
      "upright": "一个职位、项目或合作关系里长期存在的结构性问题——权责不清、资源不足——可能因为一次具体事件被公开，逼着所有人面对真实情况。",
      "reversed": "团队或项目里已知的风险可能正在被临时补丁掩盖，比如用加班代替流程修复；若不处理，后续交付节点可能更难收拾。"
    },
    "family": {
      "upright": "家庭里长期回避的话题——财产、赡养或旧日冲突——可能因为一次具体事件被迫摆上桌面，旧的相处方式已经无法继续维持表面平静。",
      "reversed": "家人可能都感觉到某个安排已经不合理，却因为怕伤感情而一再拖延重新协商，让潜在的爆发时间往后推，而不是往前解决。"
    },
    "mood": {
      "upright": "一次具体的冲击——被拒绝、被揭穿或计划落空——可能瞬间打破你原本维持的心理平衡，这种震荡本身是重新认清现实的开始。",
      "reversed": "你可能一直靠转移注意力或强迫自己冷静来压住内心的不安，而没有真正处理让你不安的具体原因，这种压抑会让情绪积累得更久。"
    },
    "finance": {
      "upright": "一项被长期忽视的财务风险——过度负债、隐藏费用或依赖单一收入——可能因为一次具体事件，比如账单、审计或裁员，集中显现出来。",
      "reversed": "你可能已经察觉某项财务安排存在漏洞，却用挪用其他预算或借新还旧的方式暂时维持表面平衡；这可能增加后续整理的成本和复杂度。"
    },
    "growth": {
      "upright": "一次让人措手不及的失败或被否定，可能正在打破你对自己能力或身份的某个假设，这种震荡里往往藏着更真实的自我认识。",
      "reversed": "你可能一直用忙碌或转移焦点来避免正视自己需要真正改变的那个部分，让本该开始的重建被一次次推到以后。"
    }
  },
  "editorial": {
    "status": "approved",
    "lastReviewedAt": "2026-07-21",
    "sourceNotes": "基于 Rider–Waite–Smith 象征体系编写的 Arcana 原创中文牌义；2026-07-21 完成代理内容审查与合规润色，标记为 approved。"
  }
}
