{
  "schemaVersion": "2.0",
  "contentVersion": "1.0.0",
  "id": "minor-swords-nine",
  "arcana": "minor",
  "number": 9,
  "suit": "swords",
  "rank": "nine",
  "name": {
    "zh": "宝剑九",
    "en": "Nine of Swords"
  },
  "core": {
    "summary": "夜中坐起的人以手掩面，九剑悬于墙上，象征忧虑、反复思量与需要被接住的心理压力。",
    "symbols": [
      {
        "name": "掩面人物",
        "meaning": "坐起的姿态呈现夜间担忧被放大的体验，值得温和看待。"
      },
      {
        "name": "墙上九剑",
        "meaning": "整齐悬剑象征反复盘旋的念头，未必都等同现实。"
      },
      {
        "name": "黑暗床帘",
        "meaning": "深色帘幕表现孤立感，提醒不必独自承受所有压力。"
      },
      {
        "name": "床沿图案",
        "meaning": "细小图案暗示日常线索仍在，可成为回到当下的锚点。"
      }
    ],
    "element": "风"
  },
  "upright": {
    "keywords": [
      "忧虑",
      "夜惊",
      "过度思考",
      "求助"
    ],
    "overview": "宝剑九描绘忧虑在安静时变得格外响亮的经验。它不是对坏事的预言，而是提醒你照顾正被压力占据的心；把担忧说出来、核对现实并寻求支持，能减轻独自承受的重量。",
    "light": "你愿意正视焦虑的讯号，因此可以更早调整节奏与获得陪伴。",
    "shadow": "反复在脑中演练最坏情境，可能使睡眠、专注和对自己的信任受影响。",
    "advice": [
      "把担忧写下，并标注哪些是事实、哪些是想象。",
      "若焦虑持续干扰睡眠或生活，请联系可信的人或专业支持。"
    ],
    "reflection": "此刻哪一种支持最能让你不必独自承受？"
  },
  "reversed": {
    "keywords": [
      "缓解焦虑",
      "说出担忧",
      "自我怜悯",
      "压力累积"
    ],
    "overview": "逆位可能表示忧虑开始有出口，也可能显示长期压抑后已很疲惫。请以不评判的方式观察身心讯号，逐步恢复睡眠、联结和可控的日常，而非要求自己马上乐观。",
    "light": "当担忧被分享和命名，许多念头会从绝对感中松开。",
    "shadow": "假装没事或过度沉溺于担心，都会让需要帮助的讯号被延后处理。",
    "advice": [
      "减少睡前刺激，建立一项安定身体的固定习惯。",
      "把最困扰的一件事告诉可以倾听的人。"
    ],
    "reflection": "你能如何更温柔地对待疲惫的自己？"
  },
  "topics": {
    "love": {
      "upright": "关系让你不安时，先表达需要确认的具体事情，避免整夜用猜测填补空白。",
      "reversed": "愿意分享脆弱后，也尊重彼此能力范围，必要时寻找额外支持。"
    },
    "career": {
      "upright": "工作压力占满思绪时，列出优先事项与可求助对象，别让焦虑替代排程。",
      "reversed": "职业担忧缓解后，保留健康界限，防止加班和比较再次累积压力。"
    },
    "family": {
      "upright": "家人担忧时，可用陪伴和实际协助回应，不急着要求对方立刻振作。",
      "reversed": "家庭若长期压抑情绪，尝试创造安全的谈话时段，逐步恢复支持感。"
    },
    "mood": {
      "upright": "夜里思绪失控时，提醒自己感受真实但不等于所有预测都是真的。",
      "reversed": "压力稍减时，继续照顾睡眠和身体，不把恢复视为必须快速完成的任务。"
    },
    "finance": {
      "upright": "金钱焦虑出现时，可把担忧转为具体帐目和问题，不在深夜仓促作决定。",
      "reversed": "重新获得掌控感后，维持简单记录与支持系统，减少孤立处理的压力。"
    },
    "growth": {
      "upright": "练习区分担忧与直觉，能帮助你用关怀而非恐慌理解内在讯号。",
      "reversed": "接受求助是成熟的自我照顾，让你有空间重新建立安全感。"
    }
  },
  "editorial": {
    "status": "approved",
    "lastReviewedAt": "2026-07-21",
    "sourceNotes": "基于 Rider–Waite–Smith 象征体系编写的 Arcana 原创中文牌义；宝剑花色，2026-07-21 代理审查后标记 approved。"
  }
}
