{
  "schemaVersion": "2.0",
  "contentVersion": "1.0.0",
  "id": "minor-wands-four",
  "arcana": "minor",
  "number": 4,
  "suit": "wands",
  "rank": "four",
  "name": {
    "zh": "权杖四",
    "en": "Four of Wands"
  },
  "core": {
    "summary": "花环搭在四根权杖之间，人们在城堡前庆祝，描绘阶段完成后可共享的安定与归属。",
    "symbols": [
      {
        "name": "花环门廊",
        "meaning": "庆典与门槛并存，象征进入一个值得停留和分享的阶段。"
      },
      {
        "name": "四根权杖",
        "meaning": "稳定结构承托欢庆，提醒自由需要可靠的基础。"
      },
      {
        "name": "庆祝者",
        "meaning": "共同见证使成果不只属于个人，也增强归属感。"
      },
      {
        "name": "远方城堡",
        "meaning": "家庭、社区或安全基地在背景中提供支持。"
      }
    ],
    "element": "火"
  },
  "upright": {
    "keywords": [
      "庆祝",
      "归属",
      "稳定",
      "里程碑"
    ],
    "overview": "一个阶段已有可被承认的成果。权杖四邀请你停下来庆祝、感谢支持者，并把临时的顺利转为能长期安放彼此的结构。",
    "light": "安全感与喜悦能够共存，你有机会在关系或环境中感到被接住。",
    "shadow": "若把和谐当作必须维持的表面，真实需求可能被压在庆祝背后。",
    "advice": [
      "为近期完成的事安排一个真诚而不过度的庆祝。",
      "感谢具体支持过你的人，也说明接下来需要怎样的协作。"
    ],
    "reflection": "什么样的空间能让你真正放松下来？"
  },
  "reversed": {
    "keywords": [
      "失衡",
      "归属不安",
      "庆祝落空",
      "基础松动"
    ],
    "overview": "看似该开心的阶段却可能伴随不自在、排斥感或现实安排失衡。逆位提示你看见仪式之外的关系质量与安全边界。",
    "light": "不合群的感受能帮助你辨认自己需要怎样的连接方式。",
    "shadow": "勉强维持热闹，可能掩盖分工不均、承诺悬空或旧矛盾。",
    "advice": [
      "在聚会或家庭安排前说明自己的时间与精力边界。",
      "把需要修复的具体问题说出来，不用等待气氛完美。"
    ],
    "reflection": "你是在享受归属，还是努力扮演合群？"
  },
  "topics": {
    "love": {
      "upright": "关系适合庆祝承诺、见家人或营造共同的安心场所。",
      "reversed": "外在仪式无法替代安全感；若有不安，温和地谈清实际期待。"
    },
    "career": {
      "upright": "团队可标记阶段成果并巩固协作流程，让士气转化为持续支持。",
      "reversed": "工作氛围表面热络却效率失衡时，回到角色、资源与责任分配。"
    },
    "family": {
      "upright": "家庭团聚带来温暖，也适合处理居住和日常分工等基础议题。",
      "reversed": "家庭庆典若触发旧角色，允许自己选择更舒适的参与方式。"
    },
    "mood": {
      "upright": "情绪较安稳，适合与可信的人共享轻松时刻。",
      "reversed": "若在热闹中感到孤单，不必责备自己，寻找一对一的真实联系。"
    },
    "finance": {
      "upright": "可为庆祝与家庭活动设定预算，在享受中保留日常缓冲。",
      "reversed": "人情支出带来压力时，诚实评估能力，拒绝不等于不重视关系。"
    },
    "growth": {
      "upright": "练习接纳支持与表达感谢，建立感会让独立更有根。",
      "reversed": "别把稳定误作停滞，检查这个环境是否仍允许你表达真实需求。"
    }
  },
  "editorial": {
    "status": "approved",
    "lastReviewedAt": "2026-07-21",
    "sourceNotes": "基于 Rider–Waite–Smith 象征体系编写的 Arcana 原创中文牌义；权杖花色首批，2026-07-21 代理审查后标记 approved。"
  }
}
