{
  "schemaVersion": "2.0",
  "contentVersion": "1.1.0",
  "id": "major-12",
  "arcana": "major",
  "number": 12,
  "romanNumeral": "XII",
  "name": {
    "zh": "倒吊人",
    "en": "The Hanged Man"
  },
  "core": {
    "summary": "主动暂停与转换视角让僵局出现理解空间",
    "symbols": [
      {
        "name": "倒悬姿态",
        "meaning": "身体倒转后看到的世界完全不同，象征主动放下惯常的判断方式。"
      },
      {
        "name": "光环",
        "meaning": "头部周围的微光提示，理解正在这段静止里悄悄发生。"
      },
      {
        "name": "T形树架",
        "meaning": "活的树木仍在生长，说明限制之中依然存在生命力。"
      },
      {
        "name": "交叠双腿",
        "meaning": "双腿的姿势暗示这并非被迫的处境，而是包含选择的悬置。"
      }
    ],
    "element": "水"
  },
  "upright": {
    "keywords": [
      "暂停",
      "视角转换",
      "主动放下",
      "内省"
    ],
    "overview": "倒吊人正位描述一种反直觉的智慧：暂停不是逃避，而是主动选择改变自己观看事物的角度。当你把日常判断的方式倒转过来，那些从常规立场看不见的联系与暗示才会浮现。头顶隐约的光晕提示，这段悬置状态本身正在孕育理解，而不是单纯的等待结果。你可能仍被某些绳索——责任、习惯、承诺——系住，但交叠的双腿说明，愿不愿意留在这个位置，仍是你自己的选择。",
    "light": "从相反的角度看问题，能让你发现原本被忽略的因果关系，也更容易理解他人的处境。",
    "shadow": "如果把倒悬当作永久姿态，暂停会变成回避决定的借口，让该处理的事继续悬空。",
    "advice": [
      "把当前处境倒过来重新描述一次：如果结果对调，谁会得到什么、失去什么？",
      "确认哪些束缚是外部强加的、哪些是自己选择继续系着的，再决定要不要松开一条。"
    ],
    "reflection": "换一个角度看，你原本笃定的判断还站得住吗？"
  },
  "reversed": {
    "keywords": [
      "消极拖延",
      "必要悬置",
      "拒绝松手",
      "假性牺牲"
    ],
    "overview": "倒吊人逆位提醒你，并非所有悬而未决都是逃避。有些等待确实还没到收尾的时机，勉强做决定反而会错过关键信息；但另一种情况是，你已经拿到足够线索，却用“再等等”把决定悬空，靠牺牲感证明自己很努力。这两种状态外表相似，区别在于：你是否仍在积累判断依据，还是只是害怕承担选择之后的结果。",
    "light": "识别出这是必要悬置，能让你安心继续观察，不必为暂时没有答案而自责。",
    "shadow": "如果只是消极拖延，长期悬空会让原本可以解决的事情持续消耗你和相关的人。",
    "advice": [
      "写下这段等待还缺少哪一项具体信息；如果答案是“没有”，说明拖延已经取代了准备。",
      "留意自己是否在用“还没准备好”反复推迟同一个决定，向信任的人说出真实顾虑。"
    ],
    "reflection": "这份悬而未决，是在等待关键信息，还是在等待勇气？"
  },
  "topics": {
    "love": {
      "upright": "这段关系可能正处在一个刻意慢下来的阶段——你没有推进，也没有退出，而是在观察对方在不同情境下的反应。这种暂停如果出于清醒选择，能让你看清关系的真实节奏，而不是被最初的兴奋牵着走。",
      "reversed": "如果暂停已经变成回避表白、回避分开或回避一次必要对话的方式，这段感情就被卡在了假性平静里。先分辨自己是在等对方先开口，还是根本不想面对答案。"
    },
    "career": {
      "upright": "职场上，你可能被要求换到一个不熟悉的位置去看待项目——比如从客户、下属或竞争对手的角度重新理解现状。这种视角切换本身就是一种工作，不必急着立刻产出结论。",
      "reversed": "一份迟迟没有推进的提案、谈判或转岗申请，可能已经从“时机未到”变成了“不敢面对结果”的拖延。检查你手上是否真的还缺关键信息，还是只是缺一次开口的勇气。"
    },
    "family": {
      "upright": "家庭里某个长期争执的话题，可能适合暂时搁置，先各自从对方的立场想一次这件事为什么重要。不急着裁决对错，能让下一次对话有新的入口。",
      "reversed": "有人可能借“再看看”长期回避一次必须做的家庭决定——分家、赡养安排或旧矛盾的了解。先分清这是真的需要时间沉淀，还是没人愿意先开口。"
    },
    "mood": {
      "upright": "情绪上你可能进入一种悬浮状态：不特别低落，也谈不上轻松，只是暂时脱离了平常反应问题的方式。这种状态可以是恢复视角的空间，不必急着给它贴上好或不好的标签。",
      "reversed": "如果这种悬浮感已经持续很久，且伴随隐隐的自我牺牲感，说明情绪可能在用停滞代替真正的处理。留意自己是否在等某种外部许可才敢往前走。"
    },
    "finance": {
      "upright": "面对一项还看不清全貌的开支或收入变化，倒吊人建议你先暂停判断，从预算之外的角度——比如未来一年的实际需求——重新核对这笔钱的位置，而不是急着下结论。",
      "reversed": "一项该处理的账单、债务或合同若被反复搁置，拖延本身会带来利息、违约金或错过窗口期等具体代价。列出这笔钱现在缺少的具体信息，再判断是否已经可以决定。"
    },
    "growth": {
      "upright": "这个阶段的成长功课，更多是关于练习从不同立场理解同一件事，而不是马上产出新的行动计划。允许自己停留在“还不确定”里，观察这种状态本身教会你什么。",
      "reversed": "长期停留在思考而不落地，可能已经从必要的沉淀变成对改变本身的恐惧。辨认你迟迟没有开始的那件事，缺的是理解还是行动。"
    }
  },
  "editorial": {
    "status": "approved",
    "lastReviewedAt": "2026-07-21",
    "sourceNotes": "基于 Rider–Waite–Smith 象征体系编写的 Arcana 原创中文牌义；2026-07-21 完成代理内容审查与合规润色，标记为 approved。"
  }
}
