{
  "schemaVersion": "2.0",
  "contentVersion": "1.0.0",
  "id": "minor-cups-five",
  "arcana": "minor",
  "number": 5,
  "suit": "cups",
  "rank": "five",
  "name": {
    "zh": "圣杯五",
    "en": "Five of Cups"
  },
  "core": {
    "summary": "黑衣人凝视洒落的杯子，身后仍有两杯与桥梁，描绘失落后的哀悼与转身",
    "symbols": [
      {
        "name": "倾倒杯液",
        "meaning": "流失的酒液允许遗憾拥有被承认的位置"
      },
      {
        "name": "黑色斗篷",
        "meaning": "斗篷包住悲伤，也暂时遮蔽尚存的选择"
      },
      {
        "name": "身后双杯",
        "meaning": "未倒的两杯提醒支持并未完全离开"
      },
      {
        "name": "河上石桥",
        "meaning": "桥梁指向穿过情绪而非困住其中的路径"
      }
    ],
    "element": "水"
  },
  "upright": {
    "keywords": [
      "哀悼修复",
      "承认失去",
      "寻找余温",
      "直觉"
    ],
    "overview": "黑衣人凝视洒落的杯子，身后仍有两杯与桥梁，描绘失落后的哀悼与转身。正位时，哀悼修复不是只凭一时感动，而是愿意辨认自己与他人的需要，并用恰当的表达让关系或内在体验继续流动。",
    "light": "你能从细微感受中获得方向，并让承认失去成为靠近自己或他人的桥梁。",
    "shadow": "若只追逐情绪高点，哀悼修复也可能忽略边界、节奏或尚待确认的事实。",
    "advice": [
      "围绕允许难过安排一次具体而温和的行动。",
      "先说清自己的感受，再听完对方的回应。"
    ],
    "reflection": "此刻的哀悼修复希望你如何被认真对待？"
  },
  "reversed": {
    "keywords": [
      "沉溺遗憾",
      "只看缺口",
      "情绪回流",
      "界限模糊"
    ],
    "overview": "黑衣人凝视洒落的杯子，身后仍有两杯与桥梁，描绘失落后的哀悼与转身。逆位把注意力带向沉溺遗憾：感受可能被压下、放大或绕开了真正的问题；先辨认触发点，才能选择贴近自己的回应。",
    "light": "看见沉溺遗憾能让你停止勉强配合，重新安排情感与精力的去向。",
    "shadow": "长期停在沉溺遗憾里，容易让误解累积，或以沉默和想象代替实际沟通。",
    "advice": [
      "为沉溺遗憾留出命名与整理的时间。",
      "把猜测改写成一个可以询问的问题。"
    ],
    "reflection": "你正在保护自己，还是被旧有感受牵住？"
  },
  "topics": {
    "love": {
      "upright": "感情中，哀悼修复时可以坦诚的方式表达期待，也尊重双方靠近的速度，让感受与现实安排保持清楚的联系。",
      "reversed": "亲密关系中，沉溺遗憾时可暂停投射或冷处理，先确认彼此真正听见了什么，让感受与现实安排保持清楚的联系。"
    },
    "career": {
      "upright": "工作协作中，哀悼修复时可用同理和清晰沟通理解团队需要，再决定投入方式，让感受与现实安排保持清楚的联系。",
      "reversed": "职场互动中，沉溺遗憾时可区分个人感受与工作事实，避免在委屈中替人承担，让感受与现实安排保持清楚的联系。"
    },
    "family": {
      "upright": "家庭相处中，哀悼修复时可通过一件关照彼此的日常小事增进理解，让感受与现实安排保持清楚的联系。",
      "reversed": "家人沟通中，沉溺遗憾时可让难以启齿的感受有安全的表达时机，让感受与现实安排保持清楚的联系。"
    },
    "mood": {
      "upright": "情绪状态中，哀悼修复时可允许感受被体验，并用写作、音乐或安静散步帮助流动，让感受与现实安排保持清楚的联系。",
      "reversed": "内在情绪中，沉溺遗憾时可先照顾休息与身体感受，不急着给自己下结论，让感受与现实安排保持清楚的联系。"
    },
    "finance": {
      "upright": "财务感受上，可观察哀悼修复是否影响消费期待，并记录让自己安心的支出边界。",
      "reversed": "财务焦虑出现沉溺遗憾时，先回看预算与实际需求，不用消费来填补情绪空缺。"
    },
    "growth": {
      "upright": "个人成长中，哀悼修复时可练习把直觉转成可被检验和实践的选择，让感受与现实安排保持清楚的联系。",
      "reversed": "自我探索中，沉溺遗憾时可辨认哪些旧故事仍在影响你对自己的判断，让感受与现实安排保持清楚的联系。"
    }
  },
  "editorial": {
    "status": "approved",
    "lastReviewedAt": "2026-07-21",
    "sourceNotes": "基于 Rider–Waite–Smith 象征体系编写的 Arcana 原创中文牌义；圣杯花色，2026-07-21 代理审查后标记 approved。"
  }
}
