{
  "schemaVersion": "2.0",
  "contentVersion": "1.0.0",
  "id": "minor-pentacles-queen",
  "arcana": "minor",
  "number": 13,
  "suit": "pentacles",
  "rank": "queen",
  "name": {
    "zh": "钱币王后",
    "en": "Queen of Pentacles"
  },
  "core": {
    "summary": "王后坐在繁茂花园中凝望钱币，象征滋养、务实照料与让丰盛可被日常共享。",
    "symbols": [
      {
        "name": "花园王座",
        "meaning": "繁花围绕的王座代表照料环境所形成的安稳。"
      },
      {
        "name": "怀抱钱币",
        "meaning": "温柔注视钱币象征对资源的珍惜与负责。"
      },
      {
        "name": "山羊纹饰",
        "meaning": "山羊图案指向耐性、繁殖力与脚踏实地的本能。"
      },
      {
        "name": "兔子",
        "meaning": "脚边兔子象征生命力、繁衍与自然节律。"
      }
    ],
    "element": "土"
  },
  "upright": {
    "keywords": [
      "滋养",
      "务实",
      "丰盛",
      "照料"
    ],
    "overview": "王后把钱币安放在繁茂的庭园里，正位体现把资源化为温暖、健康与可持续环境的能力。她提醒你，照料自己与他人同样需要边界和现实安排。",
    "light": "你能兼顾感受与细节，让关怀真正变成可依靠的生活支持。",
    "shadow": "若总是优先满足他人，丰富的能力也可能变成看不见的耗损。",
    "advice": [
      "给一项照料行为设定你也能长期承受的界限。",
      "用整理、烹饪或亲近自然为自己补充能量。"
    ],
    "reflection": "你如何让关怀既温暖又不耗尽自己？"
  },
  "reversed": {
    "keywords": [
      "过度付出",
      "失衡照料",
      "自我忽略",
      "环境失序"
    ],
    "overview": "逆位提示照料的天平已倾斜：可能是过度承担、用物质安抚情绪，或生活环境失去支撑感。它邀请你把自己的需要放回照顾名单。",
    "light": "允许被照料能让你的给予不再来自长期透支。",
    "shadow": "把所有人安顿好才准休息的信念，会逐渐掏空耐心与喜悦。",
    "advice": [
      "列出一件可以委托、延后或共同完成的照料事务。",
      "检查居住与工作空间中最消耗你的一个角落。"
    ],
    "reflection": "你把自己的需要排在第几位？"
  },
  "topics": {
    "love": {
      "upright": "温柔的日常照顾能增进亲密，也要让双方都有给予的机会。",
      "reversed": "若一方总在照顾、另一方总在被照顾，关系需要重谈平衡。"
    },
    "career": {
      "upright": "适合营造支持性的工作环境，并以务实方式整合资源。",
      "reversed": "过度承担团队的情绪劳动时，需明确哪些责任不属于自己。"
    },
    "family": {
      "upright": "家庭里可通过食物、空间和稳定陪伴创造安全感。",
      "reversed": "照料责任失衡时，别让沉默取代对分工的讨论。"
    },
    "mood": {
      "upright": "亲近植物、动物或身体感受，可帮助情绪回到温和节奏。",
      "reversed": "用购物或忙碌安抚不安时，先听见真正缺少的是什么。"
    },
    "finance": {
      "upright": "可观察资源是否支持居住、健康和日常照料等实际价值。",
      "reversed": "为照顾他人而忽略自身需求时，需重新看待可承受的范围。"
    },
    "growth": {
      "upright": "学习接收关怀，会让你的慷慨更有健康的持续性。",
      "reversed": "从“必须有用”中松开一点，允许自己单纯休息。"
    }
  },
  "editorial": {
    "status": "approved",
    "lastReviewedAt": "2026-07-21",
    "sourceNotes": "基于 Rider–Waite–Smith 象征体系编写的 Arcana 原创中文牌义；钱币花色，2026-07-21 代理审查后标记 approved。"
  }
}
